{
  "$schema": "https://json-schema.org/draft/2020-12/schema",
  "$id": "https://heimgewebe.local/schemas/audiozentrale-remote-bridge.v1.schema.json",
  "title": "Audiozentrale remote bridge v1",
  "type": "object",
  "additionalProperties": false,
  "required": [
    "schema_version",
    "kind",
    "id",
    "status",
    "schema_binding",
    "bridge",
    "tailscale_serve",
    "runtime_acceptance",
    "runtime_acceptance_state"
  ],
  "properties": {
    "schema_version": {
      "const": 1
    },
    "kind": {
      "const": "audiozentrale_remote_bridge_contract"
    },
    "id": {
      "const": "audiozentrale-remote-bridge-v1"
    },
    "status": {
      "const": "runtime-evidence-gated"
    },
    "schema_binding": {
      "type": "object",
      "additionalProperties": false,
      "required": [
        "path",
        "sha256"
      ],
      "properties": {
        "path": {
          "const": "schemas/audiozentrale-remote-bridge.v1.schema.json"
        },
        "sha256": {
          "type": "string",
          "pattern": "^[0-9a-f]{64}$"
        }
      }
    },
    "bridge": {
      "type": "object",
      "additionalProperties": false,
      "required": [
        "listen_host",
        "listen_port",
        "backend_host",
        "backend_port",
        "methods",
        "static_routes",
        "fixed_api_routes",
        "snapshot_queries",
        "profile_plan_pattern",
        "recording_media_pattern",
        "h2_remote_transfer_budget_pattern",
        "h2_remote_import_budget_pattern",
        "h2_material_media_pattern",
        "h2_source_media_pattern",
        "request_header_forward",
        "backend_headers_synthesized",
        "response_header_forward",
        "bridge_response_header",
        "json_scrubbing",
        "effect_scope",
        "effect_exclusions",
        "remote_action",
        "effect_authority",
        "backend_remote_exposure"
      ],
      "properties": {
        "listen_host": {
          "const": "127.0.0.1"
        },
        "listen_port": {
          "const": 8766
        },
        "backend_host": {
          "const": "127.0.0.1"
        },
        "backend_port": {
          "const": 8765
        },
        "methods": {
          "const": [
            "GET",
            "HEAD",
            "POST"
          ]
        },
        "static_routes": {
          "type": "array",
          "minItems": 1,
          "uniqueItems": true,
          "items": {
            "type": "string",
            "pattern": "^/"
          }
        },
        "fixed_api_routes": {
          "const": [
            "/api/v1/health",
            "/api/v1/telemetry",
            "/api/v1/replay",
            "/api/v1/whale/lesson",
            "/api/v1/recordings",
            "/api/v1/h2",
            "/api/v1/h2/budget",
            "/api/v1/h2/source",
            "/api/v1/h2/source/budget",
            "/api/v1/h2/library",
            "/api/v1/h2/library/budget",
            "/api/v1/h2/remote-inbox",
            "/api/v1/h2/remote-inbox/budget"
          ]
        },
        "snapshot_queries": {
          "const": [
            "",
            "refresh=1"
          ]
        },
        "profile_plan_pattern": {
          "const": "/api/v1/profiles/{profile_id}/plan"
        },
        "recording_media_pattern": {
          "const": "/api/v1/recordings/{session_id}/{audio|midi}"
        },
        "request_header_forward": {
          "const": [
            "If-None-Match",
            "Range"
          ]
        },
        "backend_headers_synthesized": {
          "const": [
            "Host",
            "Connection"
          ]
        },
        "response_header_forward": {
          "type": "array",
          "minItems": 1,
          "uniqueItems": true,
          "items": {
            "type": "string",
            "minLength": 1
          }
        },
        "bridge_response_header": {
          "type": "object",
          "additionalProperties": false,
          "required": [
            "name",
            "value"
          ],
          "properties": {
            "name": {
              "const": "X-Audio-Remote-Bridge"
            },
            "value": {
              "const": "read-only-v1"
            }
          }
        },
        "json_scrubbing": {
          "type": "object",
          "additionalProperties": false,
          "required": [
            "enabled",
            "policy",
            "must_remove",
            "invalid_json"
          ],
          "properties": {
            "enabled": {
              "const": true
            },
            "policy": {
              "const": "recursive-key-name"
            },
            "must_remove": {
              "type": "array",
              "minItems": 1,
              "uniqueItems": true,
              "items": {
                "type": "string",
                "minLength": 1
              }
            },
            "invalid_json": {
              "const": "fail-closed"
            }
          }
        },
        "effect_scope": {
          "const": [
            "whale:start",
            "whale:mode",
            "whale:stop",
            "recording:plan",
            "recording:prepare",
            "recording:start",
            "recording:stop",
            "recording:recover",
            "recording:categorize",
            "recording:trash",
            "recording:restore",
            "h2:import",
            "h2:annotate"
          ]
        },
        "effect_exclusions": {
          "const": [
            "profiles",
            "routing",
            "devices",
            "system",
            "h2:delete-source"
          ]
        },
        "remote_action": {
          "type": "object",
          "additionalProperties": false,
          "required": [
            "session_route",
            "session_method",
            "action_route",
            "tailnet_host",
            "session_header",
            "session_ttl_seconds",
            "session_capacity",
            "max_body_bytes",
            "operations",
            "modes",
            "tailscale_identity_required",
            "session_identity_bound",
            "backend_action_token_exposed",
            "action_response_marker",
            "effects_header",
            "effects_value",
            "recording_action_route",
            "recording_max_body_bytes",
            "recording_operations",
            "recording_modes",
            "recording_action_response_marker",
            "recording_effects_value",
            "h2_action_route",
            "h2_max_body_bytes",
            "h2_operations",
            "h2_action_response_marker",
            "h2_effects_value"
          ],
          "properties": {
            "session_route": {
              "const": "/bridge/v1/session"
            },
            "session_method": {
              "const": "POST"
            },
            "action_route": {
              "const": "/bridge/v1/actions/whale"
            },
            "tailnet_host": {
              "const": "heim-pc.tail6dbb90.ts.net:9443"
            },
            "session_header": {
              "const": "X-Audio-Bridge-Session"
            },
            "session_ttl_seconds": {
              "const": 900
            },
            "session_capacity": {
              "const": 8
            },
            "max_body_bytes": {
              "const": 512
            },
            "operations": {
              "const": [
                "start",
                "mode",
                "stop"
              ]
            },
            "modes": {
              "const": [
                "morph",
                "organic",
                "realistic",
                "ufo"
              ]
            },
            "tailscale_identity_required": {
              "const": true
            },
            "session_identity_bound": {
              "const": true
            },
            "backend_action_token_exposed": {
              "const": false
            },
            "action_response_marker": {
              "const": "whale-action-v1"
            },
            "effects_header": {
              "const": "X-Audio-Remote-Effects"
            },
            "effects_value": {
              "const": "whale-v1"
            },
            "recording_action_route": {
              "const": "/bridge/v1/actions/recording"
            },
            "recording_max_body_bytes": {
              "const": 1024
            },
            "recording_operations": {
              "const": [
                "plan",
                "prepare",
                "start",
                "stop",
                "recover",
                "categorize",
                "trash",
                "restore"
              ]
            },
            "recording_modes": {
              "const": [
                "voice",
                "piano-vocal"
              ]
            },
            "recording_action_response_marker": {
              "const": "recording-action-v1"
            },
            "recording_effects_value": {
              "const": "recording-v1"
            },
            "h2_action_route": {
              "const": "/bridge/v1/actions/h2"
            },
            "h2_max_body_bytes": {
              "const": 16384
            },
            "h2_operations": {
              "const": [
                "import",
                "annotate"
              ]
            },
            "h2_action_response_marker": {
              "const": "h2-action-v1"
            },
            "h2_effects_value": {
              "const": "h2-material-v1"
            }
          }
        },
        "effect_authority": {
          "const": true
        },
        "backend_remote_exposure": {
          "const": false
        },
        "h2_remote_transfer_budget_pattern": {
          "const": "/api/v1/h2/remote-inbox/transfer-budget/{transfer_id}"
        },
        "h2_remote_import_budget_pattern": {
          "const": "/api/v1/h2/remote-inbox/import-budget/{transfer_id}/{scene}"
        },
        "h2_source_media_pattern": {
          "const": "/api/v1/h2/source/{scene}/audio/{segment_index}"
        },
        "h2_material_media_pattern": {
          "const": "/api/v1/h2/material/{material_id}/audio/{segment_index}"
        }
      }
    },
    "tailscale_serve": {
      "type": "object",
      "additionalProperties": false,
      "required": [
        "tool",
        "https_port",
        "target",
        "tailnet_only",
        "public_exposure",
        "preserve_other_config",
        "forbidden_operations"
      ],
      "properties": {
        "tool": {
          "const": "tailscale serve"
        },
        "https_port": {
          "const": 9443
        },
        "target": {
          "const": "http://127.0.0.1:8766"
        },
        "tailnet_only": {
          "const": true
        },
        "public_exposure": {
          "const": false
        },
        "preserve_other_config": {
          "const": true
        },
        "forbidden_operations": {
          "const": [
            "funnel",
            "reset",
            "clear"
          ]
        }
      }
    },
    "runtime_acceptance": {
      "type": "object",
      "additionalProperties": false,
      "required": [
        "bridge_service_verified",
        "tailscale_serve_verified",
        "ipad_https_reachability_verified",
        "ipad_safari_verified",
        "pwa_installation_verified"
      ],
      "properties": {
        "bridge_service_verified": {
          "type": "boolean"
        },
        "tailscale_serve_verified": {
          "type": "boolean"
        },
        "ipad_https_reachability_verified": {
          "type": "boolean"
        },
        "ipad_safari_verified": {
          "type": "boolean"
        },
        "pwa_installation_verified": {
          "type": "boolean"
        }
      }
    },
    "runtime_acceptance_state": {
      "type": "object",
      "additionalProperties": false,
      "required": [
        "path",
        "mode",
        "max_ttl_seconds",
        "fail_closed",
        "binds_bridge_sha256"
      ],
      "properties": {
        "path": {
          "const": "~/.local/state/audio-remote-bridge-v1/acceptance.json"
        },
        "mode": {
          "const": "0600"
        },
        "max_ttl_seconds": {
          "const": 604800
        },
        "fail_closed": {
          "const": true
        },
        "binds_bridge_sha256": {
          "const": true
        }
      }
    }
  }
}
